Título,Coordenador,Campus,Período de Execução
Curso de programação de aplicativos móveis baseado em aprendizagem orientada a projeto,Joyce Meire da Silva Franca,PORTEIRINHA,De 01/05/2019 a 20/12/2019
A IMPRESSORA 3D COMO UMA PODEROSA FERRAMENTA NA PRODUÇÃO DE TECNOLOGIA ASSISTIVA,Caio Venancio Duarte Carvalho,PORTEIRINHA,De 09/10/2019 a 20/12/2019
MÚSICA: UM INSTRUMENTO DE ENSINO E INTEGRAÇÃO ESTUDANTIL,Caio Venancio Duarte Carvalho,PORTEIRINHA,De 09/10/2019 a 20/12/2019
O IFNMG ? Campus Salinas vai a campo: PIQ´s de polpas de frutas congeladas comercializadas no território da cidadania do Alto Rio Pardo de Minas Gerais,Alexandre Santos de Souza,SALINAS,De 02/05/2019 a 20/12/2019
"Pragas Urbanas: ""Bichos SA""",Valeria Magro Octaviano Bernis,SALINAS,De 01/05/2019 a 23/12/2019
EDUCAÇÃO HUMANITÁRIA: A LUDICIDADE NA TRANSMISSÃO DE CONCEITOS SOBRE CUIDADOS COM ANIMAIS E PROMOÇÃO DA SAÚDE PÚBLICA,Vanessa Paulino da Cruz Vieira,SALINAS,De 01/05/2019 a 18/12/2019
"VETSAL RURAL- Clínica, Cirurgia e Reprodução de Grandes Animais",Walter Octaviano Bernis Filho,SALINAS,De 02/05/2019 a 31/10/2019
Portfólio de Oportunidades,Felipe Cimino Duarte,SALINAS,De 15/04/2019 a 15/10/2019
Projeto de Intervenção pedagógica ( Curso preparatório para o ENEM de Física ),Geraldo Magela Cardoso,SALINAS,De 03/05/2019 a 31/10/2019
PROPOSTA DE GESTÃO DE ACOMPANHAMENTO DOS PRÉ-EGRESSOS E EGRESSOS NO IFNMG-CAMPUS SALINAS ? PARTE 2,Romildo Lopes de Oliveira,SALINAS,De 02/05/2019 a 23/12/2019
Sustentabilidade Ambiental,Jane Bruna de Almeida,SALINAS,De 01/06/2019 a 20/12/2019
CONVIVÊNCIA COM A SECA: experiência de comunidades rurais nas regiões do Vale do Jequitinhonha e Norte de Minas Gerais,Ronaldo Medeiros dos Santos,SALINAS,De 02/05/2019 a 31/10/2019
Avaliação das boas práticas de fabricação em agroindústrias de doce de marmelo e capacitação dos produtores para adequação às normas,Andreia de Paula Viana,SALINAS,De 02/05/2019 a 30/10/2019
"III Festival Intercampi de Culturas: Encantos dos Vales, Montes e Sertões do IFNMG",Fabiene Brito Mendes Teles,SALINAS,De 03/06/2019 a 23/12/2019
Acompanhamento de Egressos,Vanessa Paulino da Cruz Vieira,SALINAS,De 01/06/2019 a 30/11/2019
Aplicação de conceitos físicos de maneira interdisciplinar ?robótica educacional?.,Maria da Penha de Laia,SALINAS,De 02/05/2019 a 31/10/2019
Verificação das condições higiênico-sanitárias do requeijão do norte produzido na microrregião de Salinas - Minas Gerais,Felipe Cimino Duarte,SALINAS,De 02/05/2019 a 31/10/2019
Análises microbiológicas de Alimentos servidos frescos em restaurante na cidade de Salinas-MG.,Edilene Alves Barbosa,SALINAS,De 02/05/2019 a 31/10/2019
IDENTIFICAÇÃO DO ESTÁGIO DE DETERIORAÇÃO DE DOCES DE LEITE ARTESANAIS VISANDO À VALORIZAÇÃO DO PRODUTO.,Roberta Magalhaes Dias Cardozo,SALINAS,De 02/05/2019 a 31/10/2019
Castração e Controle Populacional de Cães e Gatos no município de Salinas-MG,Walter Octaviano Bernis Filho,SALINAS,De 02/05/2019 a 31/10/2019
Construção e aplicação de aparatos experimentais de Física como recurso pedagógico no ensino médio da Escola Estadual Doutor Osvaldo Prediliano Sant´Anna em Salinas-MG,Vailton Afonso da Silva,SALINAS,De 20/05/2019 a 20/11/2019
Educação para a saúde sexual e reprodutiva,Sileimar Maria Lelis,SALINAS,De 02/05/2019 a 20/12/2019
"Avaliação das características físicas e químicas da polpa do fruto de coquinho azedo (ButiaCapitata) produzida no município de Taiobeiras/MG, e elaboração de uma geleia com diferentes concentrações de sólidos solúveis",Valdirene Rodrigues Santana,SALINAS,De 02/05/2019 a 22/12/2019
Intercâmbio de boas práticas agroflorestais no âmbito da agricultura familiar na região do Alto Rio Pardo/MG,Vinicius Orlandi Barbosa Lima,SALINAS,De 02/05/2019 a 23/12/2019
AVALIAÇÃO DE HIDROGEL ELABORADO A PARTIR DA PECTINA DO MESOCARPO EXTERNO DO PEQUI (Caryocar brasiliense Camb.) APLICADO NO SOLO COMO ALTERNATIVA NO AUMENTO DA CAPACIDADE DE ARMAZENAMENTO DE ÁGUA EM PLANTAÇÕES.,Isis Celena Amaral,SALINAS,De 02/05/2019 a 31/10/2019
BUSCA DE NOVAS MELHORIAS NA PRODUÇÃO DA CACHAÇA DOS PEQUENOS PRODUTORES DA REGIÃO DE SALINAS ? MG.,Geraldo Magela Matos,SALINAS,De 02/05/2019 a 02/11/2019
MEDICINA VETERINÁRIA NO QUILOMBO: UMA AÇÃO DO NEABI NA SAÚDE ÚNICA.,Thais Larissa Lourenco Castanheira,SALINAS,De 02/05/2019 a 31/10/2019
VERIFICAÇÃO DAS BOAS PRÁTICAS DE FABRICAÇÃO E DA QUALIDADE MICROBIOLÓGICA DO DOCE DE LEITE PRODUZIDO EM SALINAS - MG,Roberta Magalhaes Dias Cardozo,SALINAS,De 02/05/2019 a 31/10/2019
EXTENSÃO RURAL: O PAPEL DO MÉDICO VETERINÁRIO NA ORIENTAÇÃO DO PLANEJAMENTO DAS INSTALAÇÕES RURAIS EM PEQUENAS PROPRIEDADES RURAIS NO MUNICÍPIO DE SALINAS?MG,Fernando Matos Pereira,SALINAS,De 02/05/2019 a 23/12/2019
Espaço do Basquete,Arthur Faria Porto,SALINAS,De 01/01/2019 a 31/12/2019
Cultura alimentar e sustentabilidade na produção de alimentos saudáveis: resgate de práticas culinárias e fomento da segurança alimentar em comunidades quilombolas na mesorregião do Vale do Jequitinhonha.,Ricardo dos Santos Silva,SALINAS,De 02/05/2019 a 20/12/2019
"AVALIAÇÃO MICROBIOLÓGICA DAS CONDIÇÕES DE HIGIENE E SANITIZAÇÃO DOS TALHERES, PRATOS E BANDEJAS UTILIZADOS NO REFEITÓRIO DO INSTITUTO FEDERAL DO NORTE DE MINAS-CAMPUS SALINAS",Edilene Alves Barbosa,SALINAS,De 27/07/2019 a 13/12/2019
Capacitação da população carcerária atendida pela Associação de Proteção e Assistência aos Condenados (APAC) Salinas - MG para a produção de produtos de panificação,Bruna Castro Porto,SALINAS,De 09/09/2019 a 11/10/2019
Gerenciamento de Resíduos Sólidos no Campus Teófilo Otoni,Ivan Carlos Carreiro Almeida,TEÓFILO OTONI,De 01/04/2019 a 10/10/2019
?Árvore Delivery: Fomento da Arborização e Mapeamento das Àrvores Urbanas De Teófilo Otoni - MG,Ivan Carlos Carreiro Almeida,TEÓFILO OTONI,De 02/05/2019 a 31/10/2019
Mucuri Cultura e Arte,Leandro de Paula Liberato,TEÓFILO OTONI,De 01/04/2019 a 30/09/2019
Introdução à Programação de Computadores para alunos do ensino fundamental e médio por meio da ferramenta Scratch 3,Yuri Bento Marques,TEÓFILO OTONI,De 02/05/2019 a 31/12/2019
AMIZADE SEM IDADE,Luara Cristiane Dourado Neves,TEÓFILO OTONI,De 30/03/2019 a 23/12/2019
Projeto: Ouvindo os egressos e empregadores,Tarrara Alves Horsth,TEÓFILO OTONI,De 03/06/2019 a 23/12/2019
Portfólio de oportunidades,Ana Claudia Goncalves de Sa Jardim,TEÓFILO OTONI,De 01/04/2019 a 10/10/2019
Inclusão digital - A busca pelo conhecimento não tem idade,Gerfson Viana Santos,TEÓFILO OTONI,De 01/06/2019 a 23/12/2019
IFNMG Cultura e Arte,Leandro de Paula Liberato,TEÓFILO OTONI,De 02/05/2019 a 23/12/2019
"Identificação e divulgação dos agentes, eventos, projetos e espaços culturais na cidade de Teófilo Otoni/MG",Yuri Bento Marques,TEÓFILO OTONI,De 02/05/2019 a 31/10/2019
Xadrez nas escolas - Desenvolvendo Habilidades do Ensino pela prática do Xadrez,Heverton Schimidt Souza,TEÓFILO OTONI,De 02/05/2019 a 31/10/2019
RUMO AO PÓDIO - Um curso intensivo de Matemática Olímpica,Carlos Alberto Lopes dos Santos de Oliveira,TEÓFILO OTONI,De 01/05/2019 a 20/12/2019
Projeto Hâpó,Edimar da Rocha Pinto,TEÓFILO OTONI,De 04/11/2019 a 20/12/2019
"Pré-IFNMG: Meritocracia, Igualdade de Oportunidades e Equidade",Carlos Alberto Lopes dos Santos de Oliveira,TEÓFILO OTONI,De 25/06/2019 a 20/12/2019
Orientação Profissional: Um Olhar para o Futuro,Paula Pontes do Espirito Santo,TEÓFILO OTONI,De 30/04/2019 a 10/09/2019
